{
  "last_check": "2026-05-26T01:47:10.634Z",
  "violations": [
    {
      "file": "bun /tmp/fix_note.js",
      "message": "pending depcruiser check",
      "severity": "info"
    },
    {
      "file": "bun /tmp/upd_inv.js",
      "message": "pending depcruiser check",
      "severity": "info"
    },
    {
      "file": "npx tsx .opencode/scripts/framework-self-test.ts",
      "message": "pending depcruiser check",
      "severity": "info"
    },
    {
      "file": "npx tsx .opencode/scripts/state-reconciliation.ts",
      "message": "pending depcruiser check",
      "severity": "info"
    },
    {
      "file": "touch .opencode/scripts/mcp-tools/compliance-gate.ts",
      "message": "pending depcruiser check",
      "severity": "info"
    },
    {
      "file": "bun .opencode/scripts/framework-self-test.ts",
      "message": "pending depcruiser check",
      "severity": "info"
    },
    {
      "file": "tail -20 .opencode/scripts/state-transaction.ts",
      "message": "pending depcruiser check",
      "severity": "info"
    },
    {
      "file": "tail -10 .opencode/scripts/mcp-tools/compliance-gate.ts",
      "message": "pending depcruiser check",
      "severity": "info"
    },
    {
      "file": ".opencode/lib/gate-checks.ts",
      "message": "pending depcruiser check",
      "severity": "info"
    },
    {
      "file": ".opencode/plugins/scope-before.ts",
      "message": "pending depcruiser check",
      "severity": "info"
    },
    {
      "file": "booking_system_refactor/booking-backend/src/modules/admin/controllers/admin-settings.controller.spec.ts",
      "message": "pending depcruiser check",
      "severity": "info"
    },
    {
      "file": "booking_system_refactor/booking-backend/src/main.spec.ts",
      "message": "pending depcruiser check",
      "severity": "info"
    },
    {
      "file": "bun .opencode/scripts/framework-self-test.js",
      "message": "pending depcruiser check",
      "severity": "info"
    },
    {
      "file": ".opencode/scripts/framework-self-test.ts",
      "message": "pending depcruiser check",
      "severity": "info"
    },
    {
      "file": "/home/zhaoge/workspace/opencode/work-one/.opencode/lib/uc7ks-schema.ts",
      "message": "pending depcruiser check",
      "severity": "info"
    },
    {
      "file": "/home/zhaoge/workspace/opencode/work-one/.opencode/tools/module_scope_declare.ts",
      "message": "pending depcruiser check",
      "severity": "info"
    },
    {
      "file": "/home/zhaoge/workspace/opencode/work-one/.opencode/tools/knowledge_cache_search.ts",
      "message": "pending depcruiser check",
      "severity": "info"
    },
    {
      "file": "/home/zhaoge/workspace/opencode/work-one/.opencode/plugins/uc7ks-after.ts",
      "message": "pending depcruiser check",
      "severity": "info"
    },
    {
      "file": "/home/zhaoge/workspace/opencode/work-one/.opencode/plugins/dispatch-before.ts",
      "message": "pending depcruiser check",
      "severity": "info"
    },
    {
      "file": "/home/zhaoge/workspace/opencode/work-one/.opencode/scripts/framework-self-test.ts",
      "message": "pending depcruiser check",
      "severity": "info"
    },
    {
      "file": "/home/zhaoge/workspace/opencode/work-one/.opencode/lib/safe-bash-core.ts",
      "message": "pending depcruiser check",
      "severity": "info"
    },
    {
      "file": "/home/zhaoge/workspace/opencode/work-one/.opencode/plugins/audit-before.ts",
      "message": "pending depcruiser check",
      "severity": "info"
    },
    {
      "file": "/home/zhaoge/workspace/opencode/work-one/.opencode/scripts/state-reconciliation.ts",
      "message": "pending depcruiser check",
      "severity": "info"
    },
    {
      "file": "/home/zhaoge/workspace/opencode/work-one/.opencode/lib/log-manager.ts",
      "message": "pending depcruiser check",
      "severity": "info"
    },
    {
      "file": "/home/zhaoge/workspace/opencode/work-one/.opencode/scripts/mcp-tools/reconciliation-validate.ts",
      "message": "pending depcruiser check",
      "severity": "info"
    },
    {
      "file": "/home/zhaoge/workspace/opencode/work-one/.opencode/scripts/rotate-logs.ts",
      "message": "pending depcruiser check",
      "severity": "info"
    },
    {
      "file": "/home/zhaoge/workspace/opencode/work-one/.opencode/scripts/knowledge/janitor.ts",
      "message": "pending depcruiser check",
      "severity": "info"
    },
    {
      "file": "/home/zhaoge/workspace/opencode/work-one/.opencode/scripts/knowledge/compressor.ts",
      "message": "pending depcruiser check",
      "severity": "info"
    },
    {
      "file": "/home/zhaoge/workspace/opencode/work-one/.opencode/scripts/knowledge/deduplicator.ts",
      "message": "pending depcruiser check",
      "severity": "info"
    },
    {
      "file": "/home/zhaoge/workspace/opencode/work-one/.opencode/scripts/knowledge/indexer.ts",
      "message": "pending depcruiser check",
      "severity": "info"
    },
    {
      "file": "/home/zhaoge/workspace/opencode/work-one/.opencode/scripts/knowledge/scout-extractor.ts",
      "message": "pending depcruiser check",
      "severity": "info"
    },
    {
      "file": "/home/zhaoge/workspace/opencode/work-one/.opencode/scripts/knowledge/scout-trigger.ts",
      "message": "pending depcruiser check",
      "severity": "info"
    },
    {
      "file": "/home/zhaoge/workspace/opencode/work-one/.opencode/lib/gate-core.ts",
      "message": "pending depcruiser check",
      "severity": "info"
    },
    {
      "file": "/home/zhaoge/workspace/opencode/work-one/.opencode/scripts/framework-doctor.ts",
      "message": "pending depcruiser check",
      "severity": "info"
    },
    {
      "file": "/home/zhaoge/workspace/opencode/work-one/.opencode/scripts/command-tools/dispatch-subagent.ts",
      "message": "pending depcruiser check",
      "severity": "info"
    },
    {
      "file": "/home/zhaoge/workspace/opencode/work-one/.opencode/scripts/archive-dag-tasks.ts",
      "message": "pending depcruiser check",
      "severity": "info"
    },
    {
      "file": "/home/zhaoge/workspace/opencode/work-one/.opencode/scripts/nightly-compaction.ts",
      "message": "pending depcruiser check",
      "severity": "info"
    },
    {
      "file": "/home/zhaoge/workspace/opencode/work-one/.opencode/scripts/framework-compliance-check.ts",
      "message": "pending depcruiser check",
      "severity": "info"
    },
    {
      "file": "/home/zhaoge/workspace/opencode/work-one/.opencode/scripts/gate-lifecycle-audit.ts",
      "message": "pending depcruiser check",
      "severity": "info"
    },
    {
      "file": "/home/zhaoge/workspace/opencode/work-one/.opencode/scripts/state-integrity-scan.ts",
      "message": "pending depcruiser check",
      "severity": "info"
    },
    {
      "file": "/home/zhaoge/workspace/opencode/work-one/.opencode/scripts/mcp-tools/compliance-gate.ts",
      "message": "pending depcruiser check",
      "severity": "info"
    },
    {
      "file": "/home/zhaoge/workspace/opencode/work-one/.opencode/scripts/install-hooks.ts",
      "message": "pending depcruiser check",
      "severity": "info"
    },
    {
      "file": "/home/zhaoge/workspace/opencode/work-one/.opencode/scripts/state-reset.ts",
      "message": "pending depcruiser check",
      "severity": "info"
    },
    {
      "file": "/home/zhaoge/workspace/opencode/work-one/.opencode/scripts/migrate-gate-state-v2-to-v3.ts",
      "message": "pending depcruiser check",
      "severity": "info"
    },
    {
      "file": "/home/zhaoge/workspace/opencode/work-one/.opencode/scripts/rollback-state-migration.ts",
      "message": "pending depcruiser check",
      "severity": "info"
    },
    {
      "file": "/home/zhaoge/workspace/opencode/work-one/.opencode/scripts/migrate-dag-v2.ts",
      "message": "pending depcruiser check",
      "severity": "info"
    },
    {
      "file": "/home/zhaoge/workspace/opencode/work-one/.opencode/scripts/state-transaction.ts",
      "message": "pending depcruiser check",
      "severity": "info"
    },
    {
      "file": "/home/zhaoge/workspace/opencode/work-one/.opencode/scripts/monitoring-status.ts",
      "message": "pending depcruiser check",
      "severity": "info"
    },
    {
      "file": "/home/zhaoge/workspace/opencode/work-one/.opencode/scripts/pre-execution-gate.ts",
      "message": "pending depcruiser check",
      "severity": "info"
    },
    {
      "file": "/home/zhaoge/workspace/opencode/work-one/.opencode/scripts/state-canonicalize.ts",
      "message": "pending depcruiser check",
      "severity": "info"
    },
    {
      "file": "/home/zhaoge/workspace/opencode/work-one/.opencode/scripts/mcp-tools/code-quality-gate.ts",
      "message": "pending depcruiser check",
      "severity": "info"
    },
    {
      "file": "/home/zhaoge/workspace/opencode/work-one/.opencode/scripts/mcp-tools/eslint-audit.ts",
      "message": "pending depcruiser check",
      "severity": "info"
    },
    {
      "file": "/home/zhaoge/workspace/opencode/work-one/.opencode/scripts/mcp-tools/keystone-validate.ts",
      "message": "pending depcruiser check",
      "severity": "info"
    },
    {
      "file": "/home/zhaoge/workspace/opencode/work-one/.opencode/lib/dist/dag-version-manager.d.ts",
      "message": "pending depcruiser check",
      "severity": "info"
    },
    {
      "file": "/home/zhaoge/workspace/opencode/work-one/.opencode/lib/dist/dag-version-manager.js",
      "message": "pending depcruiser check",
      "severity": "info"
    },
    {
      "file": "/home/zhaoge/workspace/opencode/work-one/.opencode/lib/dist/gate-core.d.ts",
      "message": "pending depcruiser check",
      "severity": "info"
    },
    {
      "file": "/home/zhaoge/workspace/opencode/work-one/.opencode/lib/dist/gate-core.js",
      "message": "pending depcruiser check",
      "severity": "info"
    },
    {